{
  "$schema": "../category.schema.json",
  "name": "vector",
  "description": "Vector databases for embeddings and semantic search",
  "aliases": ["vectordb", "vector-db", "embeddings", "embedding", "similarity"],
  "default_protocol": "http",
  "connection_template": "http://{host}:{port}",
  "tags": ["vector", "ai", "embeddings", "search"]
}
