{
  "$schema": "../category.schema.json",
  "name": "proxy",
  "description": "Reverse proxies, load balancers, and API gateways",
  "aliases": ["gateway", "load-balancer", "lb", "ingress", "reverse-proxy"],
  "default_protocol": "http",
  "connection_template": "http://{host}:{port}",
  "tags": ["proxy", "networking", "routing"]
}
